role,title,company,city,location,description,skills,skill_count,combined_text,education,job_mode,experience_min,experience_max,days_ago,posted_date,salary_raw,salary_min,salary_max,salary_estimate,source,extracted_skills,extracted_skill_count
Cybersecurity Analyst,Analyst - SecOps,Arrow Electronics,Bengaluru,"Hybrid - Bengaluru, India",security analysis process analytical data network security soc query endpoint protection,"firewalls, linux, network security, penetration testing, siem, soc, vulnerability assessment",7,"Cybersecurity Analyst firewalls, linux, network security, penetration testing, siem, soc, vulnerability assessment security analysis process analytical data network security soc query endpoint protection B.Tech Hybrid Bengaluru",B.Tech,Hybrid,6,11,14,2 weeks ago,Not Disclosed,,,1160000,Naukri,r,1
Cybersecurity Analyst,Analyst,Specialist Advisory & Intervention Group (Saig),Mumbai,"Mumbai, India",cyber security data science Senior Analyst Artificial Intelligence cyber forensics Science Intelligence Analysis,"firewalls, linux, network security, penetration testing, siem, soc, vulnerability assessment",7,"Cybersecurity Analyst firewalls, linux, network security, penetration testing, siem, soc, vulnerability assessment cyber security data science Senior Analyst Artificial Intelligence cyber forensics Science Intelligence Analysis B.Tech On-site Mumbai",B.Tech,On-site,0,4,30,3+ weeks ago,Not Disclosed,,,800000,Naukri,r,1
Cybersecurity Analyst,Economic Analyst,Crisil,Pune,"Pune, India",Data analysis Quantitative research Analytical Information security Machine learning Predictive modeling Research Stakeholder management,"data analysis, firewalls, linux, machine learning, network security, penetration testing, siem, soc, vulnerability assessment",9,"Cybersecurity Analyst data analysis, firewalls, linux, machine learning, network security, penetration testing, siem, soc, vulnerability assessment Data analysis Quantitative research Analytical Information security Machine learning Predictive modeling Research Stakeholder management B.Tech On-site Pune",B.Tech,On-site,0,8,30,3+ weeks ago,Not Disclosed,,,800000,Naukri,"data analysis, machine learning, r",3
Cybersecurity Analyst,DI Analyst,Experian,Mumbai,"Mumbai, Kursela, India",Forecasting Business Intelligence Azure Power Bi Tableau Machine Learning Sql R,"azure, firewalls, linux, machine learning, network security, penetration testing, power bi, r, siem, soc, sql, tableau, vulnerability assessment",13,"Cybersecurity Analyst azure, firewalls, linux, machine learning, network security, penetration testing, power bi, r, siem, soc, sql, tableau, vulnerability assessment Forecasting Business Intelligence Azure Power Bi Tableau Machine Learning Sql R B.Tech On-site Mumbai",B.Tech,On-site,2,5,5,5 days ago,Not Disclosed,,,920000,Naukri,"power bi, sql, tableau, r, machine learning, azure",6
Cybersecurity Analyst,Analyst,Eclerx,Mumbai,"Navi Mumbai, India",voice service level inbound calls inbound information security interpersonal skills problem solving root cause analysis,"firewalls, linux, network security, penetration testing, siem, soc, vulnerability assessment",7,"Cybersecurity Analyst firewalls, linux, network security, penetration testing, siem, soc, vulnerability assessment voice service level inbound calls inbound information security interpersonal skills problem solving root cause analysis B.Tech On-site Mumbai",B.Tech,On-site,0,2,7,1 week ago,Not Disclosed,,,800000,Naukri,r,1
Cybersecurity Analyst,Analyst,Apm Terminals,Chennai,"Chennai, India",Training Administration Automation Excel Analytical Management Troubleshooting MS Office,"excel, firewalls, linux, network security, penetration testing, siem, soc, vulnerability assessment",8,"Cybersecurity Analyst excel, firewalls, linux, network security, penetration testing, siem, soc, vulnerability assessment Training Administration Automation Excel Analytical Management Troubleshooting MS Office B.Tech On-site Chennai",B.Tech,On-site,2,3,2,2 days ago,Not Disclosed,,,920000,Naukri,"excel, r",2
Cybersecurity Analyst,Analyst Promotions Insight-6,Target,Bengaluru,"Bengaluru, India",Business process Data analysis Automation Manager Quality Assurance Publishing Analytical Financial planning Budgeting,"data analysis, firewalls, linux, network security, penetration testing, siem, soc, vulnerability assessment",8,"Cybersecurity Analyst data analysis, firewalls, linux, network security, penetration testing, siem, soc, vulnerability assessment Business process Data analysis Automation Manager Quality Assurance Publishing Analytical Financial planning Budgeting B.Tech On-site Bengaluru",B.Tech,On-site,2,4,2,2 days ago,Not Disclosed,,,920000,Naukri,"data analysis, r",2
Cybersecurity Analyst,Analyst,Gd Research Center (Gdrc),Hyderabad,"Hyderabad, India",Operational excellence Sales operations Workflow Risk management Lead management Forecasting Operations Analytics,"firewalls, linux, network security, penetration testing, siem, soc, vulnerability assessment",7,"Cybersecurity Analyst firewalls, linux, network security, penetration testing, siem, soc, vulnerability assessment Operational excellence Sales operations Workflow Risk management Lead management Forecasting Operations Analytics B.Tech On-site Hyderabad",B.Tech,On-site,4,9,2,2 days ago,Not Disclosed,,,1040000,Naukri,"excel, r",2
Cybersecurity Analyst,VRCT - Analyst,Deloitte Consulting,Hyderabad,"Hyderabad, India",Risk Management data analytics Power BI Risk Assessment AI tools TPRM compliance Tprm Data,"firewalls, linux, network security, penetration testing, power bi, siem, soc, vulnerability assessment",8,"Cybersecurity Analyst firewalls, linux, network security, penetration testing, power bi, siem, soc, vulnerability assessment Risk Management data analytics Power BI Risk Assessment AI tools TPRM compliance Tprm Data B.Tech On-site Hyderabad",B.Tech,On-site,1,3,2,2 days ago,Not Disclosed,,,860000,Naukri,"power bi, r",2
Cybersecurity Analyst,"Analyst, Insights and Enablement",Mastercard,Gurugram,"Gurugram, India",Sql Product Management Automation Process Mapping Ai Visio Analytics Data Science,"firewalls, linux, network security, penetration testing, siem, soc, sql, vulnerability assessment",8,"Cybersecurity Analyst firewalls, linux, network security, penetration testing, siem, soc, sql, vulnerability assessment Sql Product Management Automation Process Mapping Ai Visio Analytics Data Science B.Tech On-site Gurugram",B.Tech,On-site,3,6,3,3 days ago,Not Disclosed,,,980000,Naukri,"sql, r",2
Cybersecurity Analyst,RPO COE - Analyst 168271,Adp Private Limited,Pune,"Pune, India",Automation Payroll Data analysis Manager Quality Assurance Business analysis Technical writing Equity Analytics,"data analysis, firewalls, linux, network security, penetration testing, siem, soc, vulnerability assessment",8,"Cybersecurity Analyst data analysis, firewalls, linux, network security, penetration testing, siem, soc, vulnerability assessment Automation Payroll Data analysis Manager Quality Assurance Business analysis Technical writing Equity Analytics B.Tech On-site Pune",B.Tech,On-site,3,5,3,3 days ago,Not Disclosed,,,980000,Naukri,"data analysis, r",2
Cybersecurity Analyst,Analyst,Bristol Myers Squibb,Hyderabad,"Hyderabad, India",Automation HP data protector Analytical Pharmacy Clinical trials data privacy Data mining Macros,"firewalls, linux, network security, penetration testing, siem, soc, vulnerability assessment",7,"Cybersecurity Analyst firewalls, linux, network security, penetration testing, siem, soc, vulnerability assessment Automation HP data protector Analytical Pharmacy Clinical trials data privacy Data mining Macros B.Tech On-site Hyderabad",B.Tech,On-site,1,3,3,3 days ago,Not Disclosed,,,860000,Naukri,r,1
Cybersecurity Analyst,Analyst,Barclays,Gurugram,"Gurugram, India",Data analysis Financial statements Ratio analysis Senior Analyst Analytical Finance Trend analysis Strategic planning,"data analysis, firewalls, linux, network security, penetration testing, siem, soc, vulnerability assessment",8,"Cybersecurity Analyst data analysis, firewalls, linux, network security, penetration testing, siem, soc, vulnerability assessment Data analysis Financial statements Ratio analysis Senior Analyst Analytical Finance Trend analysis Strategic planning B.Tech On-site Gurugram",B.Tech,On-site,0,8,3,3 days ago,Not Disclosed,,,800000,Naukri,"data analysis, r",2
Cybersecurity Analyst,Decision Analyst,Barclays,Gurugram,"Gurugram, India",Administration Logistic regression Data analysis data science Senior Analyst Analytical Machine learning Forecasting,"data analysis, firewalls, linux, machine learning, network security, penetration testing, siem, soc, vulnerability assessment",9,"Cybersecurity Analyst data analysis, firewalls, linux, machine learning, network security, penetration testing, siem, soc, vulnerability assessment Administration Logistic regression Data analysis data science Senior Analyst Analytical Machine learning Forecasting B.Tech On-site Gurugram",B.Tech,On-site,0,8,3,3 days ago,Not Disclosed,,,800000,Naukri,"data analysis, machine learning, r",3
Cybersecurity Analyst,Programmer/Analyst,Netapp,Bengaluru,"Bengaluru, India",erp oracle sql queries analytical software testing bi strong analytical skills oracle fusion,"firewalls, linux, network security, penetration testing, siem, soc, sql, vulnerability assessment",8,"Cybersecurity Analyst firewalls, linux, network security, penetration testing, siem, soc, sql, vulnerability assessment erp oracle sql queries analytical software testing bi strong analytical skills oracle fusion B.Tech On-site Bengaluru",B.Tech,On-site,3,5,4,4 days ago,Not Disclosed,,,980000,Naukri,"sql, r",2
Cybersecurity Analyst,Analyst,Cognizant,Chennai,"Chennai, India",project management analytical business requirements gatp consolidation sap apo sap apo dp operations,"firewalls, linux, network security, penetration testing, siem, soc, vulnerability assessment",7,"Cybersecurity Analyst firewalls, linux, network security, penetration testing, siem, soc, vulnerability assessment project management analytical business requirements gatp consolidation sap apo sap apo dp operations B.Tech On-site Chennai",B.Tech,On-site,10,12,5,5 days ago,Not Disclosed,,,1400000,Naukri,r,1
Cybersecurity Analyst,Adops - Analyst,Omnicom Global Solutions,Bengaluru,"Bengaluru, India",digital marketing digital analytical indian gaap digital campaigns strong analytical skills verbal communication auditing,"firewalls, linux, network security, penetration testing, siem, soc, vulnerability assessment",7,"Cybersecurity Analyst firewalls, linux, network security, penetration testing, siem, soc, vulnerability assessment digital marketing digital analytical indian gaap digital campaigns strong analytical skills verbal communication auditing B.Tech On-site Bengaluru",B.Tech,On-site,1,3,5,5 days ago,Not Disclosed,,,860000,Naukri,"git, r",2
Cybersecurity Analyst,Analyst (Contractual Role),Sgs India,Mumbai,"Mumbai Suburban, Thane, Navi Mumbai, India",Analytical Method Validation HPLC Capsules Tablets Method Validation Injectables Analytical Contracts,"firewalls, linux, network security, penetration testing, siem, soc, vulnerability assessment",7,"Cybersecurity Analyst firewalls, linux, network security, penetration testing, siem, soc, vulnerability assessment Analytical Method Validation HPLC Capsules Tablets Method Validation Injectables Analytical Contracts B.Tech On-site Mumbai",B.Tech,On-site,3,6,2,2 days ago,Not Disclosed,,,980000,Naukri,r,1
Cybersecurity Analyst,Analyst/ Consultant,Innergize Solutions,Mumbai,"Mumbai, Worli, India",finance management consulting business models chartered accountant accountant ipo analytical skills corporate laws,"firewalls, linux, network security, penetration testing, siem, soc, vulnerability assessment",7,"Cybersecurity Analyst firewalls, linux, network security, penetration testing, siem, soc, vulnerability assessment finance management consulting business models chartered accountant accountant ipo analytical skills corporate laws B.Tech On-site Mumbai",B.Tech,On-site,1,2,21,3 weeks ago,Not Disclosed,,,860000,Naukri,"aws, r",2
Cybersecurity Analyst,OBC Consultant,Leading Client,Other,India,compliance erp plc scada plc cybersecurity root cause analysis scada iot,"firewalls, linux, network security, penetration testing, siem, soc, vulnerability assessment",7,"Cybersecurity Analyst firewalls, linux, network security, penetration testing, siem, soc, vulnerability assessment compliance erp plc scada plc cybersecurity root cause analysis scada iot B.Tech On-site India",B.Tech,On-site,10,18,30,3+ weeks ago,Not Disclosed,,,1400000,Naukri,r,1
Cybersecurity Analyst,V&A Analyst,Accenture,Gurugram,"Gurugram, India",finance python data analytics due diligence bloomberg ai marketing communications power bi,"firewalls, linux, network security, penetration testing, power bi, python, siem, soc, vulnerability assessment",9,"Cybersecurity Analyst firewalls, linux, network security, penetration testing, power bi, python, siem, soc, vulnerability assessment finance python data analytics due diligence bloomberg ai marketing communications power bi B.Tech On-site Gurugram",B.Tech,On-site,1,4,7,1 week ago,Not Disclosed,,,860000,Naukri,"power bi, python, r",3
Cybersecurity Analyst,MDS D&A Analyst,Mondelez,Mumbai,"Mumbai, India",Supply chain Data analysis Automation SAP Business analytics Analytical Data processing Data quality,"data analysis, firewalls, linux, network security, penetration testing, siem, soc, vulnerability assessment",8,"Cybersecurity Analyst data analysis, firewalls, linux, network security, penetration testing, siem, soc, vulnerability assessment Supply chain Data analysis Automation SAP Business analytics Analytical Data processing Data quality B.Tech On-site Mumbai",B.Tech,On-site,8,13,7,1 week ago,Not Disclosed,,,1280000,Naukri,"data analysis, r",2
Cybersecurity Analyst,A&C Senior Analyst,Castrol,Pune,"Pune, India",SAP Costing Operational excellence General accounting Fixed assets Analytical Reconciliation Customer service,"firewalls, linux, network security, penetration testing, siem, soc, vulnerability assessment",7,"Cybersecurity Analyst firewalls, linux, network security, penetration testing, siem, soc, vulnerability assessment SAP Costing Operational excellence General accounting Fixed assets Analytical Reconciliation Customer service B.Tech On-site Pune",B.Tech,On-site,10,15,7,1 week ago,Not Disclosed,,,1400000,Naukri,"excel, r",2
Cybersecurity Analyst,HPLC & GC analysts,Synthesis Solutions,Bengaluru,"Bengaluru, India",ISO Compliance Analytical Standard operating procedures Packaging GMP Troubleshooting Raw material,"firewalls, linux, network security, penetration testing, siem, soc, vulnerability assessment",7,"Cybersecurity Analyst firewalls, linux, network security, penetration testing, siem, soc, vulnerability assessment ISO Compliance Analytical Standard operating procedures Packaging GMP Troubleshooting Raw material B.Tech On-site Bengaluru",B.Tech,On-site,4,9,7,1 week ago,Not Disclosed,,,1040000,Naukri,r,1
Cybersecurity Analyst,Analyst,Gallagher,Pune,"Hybrid - Pune, India",Insurance Domain Policy Administration Property And Casualty Insurance Insurance Analytics DNS Analytics Analysis Property,"firewalls, linux, network security, penetration testing, siem, soc, vulnerability assessment",7,"Cybersecurity Analyst firewalls, linux, network security, penetration testing, siem, soc, vulnerability assessment Insurance Domain Policy Administration Property And Casualty Insurance Insurance Analytics DNS Analytics Analysis Property B.Tech Hybrid Pune",B.Tech,Hybrid,1,2,7,1 week ago,Not Disclosed,,,860000,Naukri,r,1
Cybersecurity Analyst,SCD Analyst,Apm Terminals,Mumbai,"Mumbai, India",Supply chain Drilling global operations Quantitative research Analytical Employee engagement Visio Customer engagement,"firewalls, linux, network security, penetration testing, siem, soc, vulnerability assessment",7,"Cybersecurity Analyst firewalls, linux, network security, penetration testing, siem, soc, vulnerability assessment Supply chain Drilling global operations Quantitative research Analytical Employee engagement Visio Customer engagement B.Tech On-site Mumbai",B.Tech,On-site,2,4,7,1 week ago,Not Disclosed,,,920000,Naukri,r,1
Cybersecurity Analyst,SCD Analyst,A.P. Moller Maersk,Mumbai,"Mumbai, India",Supply chain Drilling global operations Quantitative research Analytical Employee engagement Visio Customer engagement,"firewalls, linux, network security, penetration testing, siem, soc, vulnerability assessment",7,"Cybersecurity Analyst firewalls, linux, network security, penetration testing, siem, soc, vulnerability assessment Supply chain Drilling global operations Quantitative research Analytical Employee engagement Visio Customer engagement B.Tech On-site Mumbai",B.Tech,On-site,2,4,7,1 week ago,Not Disclosed,,,920000,Naukri,r,1
Cybersecurity Analyst,Image Analyst,Galaxeye Space,Bengaluru,"Bengaluru, India",GIS MSI Image processing SAR Senior Analyst thermal Manager Technology Sensors,"firewalls, linux, network security, penetration testing, siem, soc, vulnerability assessment",7,"Cybersecurity Analyst firewalls, linux, network security, penetration testing, siem, soc, vulnerability assessment GIS MSI Image processing SAR Senior Analyst thermal Manager Technology Sensors B.Tech On-site Bengaluru",B.Tech,On-site,1,5,7,1 week ago,Not Disclosed,,,860000,Naukri,r,1
Cybersecurity Analyst,IND-Analyst,Lowes Services India Private Limited,Bengaluru,"Bengaluru, India",Supply chain Data analysis Manager Quality Assurance Data management Project management Customer support Customer service Continuous improvement,"data analysis, firewalls, linux, network security, penetration testing, siem, soc, vulnerability assessment",8,"Cybersecurity Analyst data analysis, firewalls, linux, network security, penetration testing, siem, soc, vulnerability assessment Supply chain Data analysis Manager Quality Assurance Data management Project management Customer support Customer service Continuous improvement B.Tech On-site Bengaluru",B.Tech,On-site,2,5,7,1 week ago,Not Disclosed,,,920000,Naukri,"data analysis, r",2
Cybersecurity Analyst,Growth Analyst,Medibuddy,Bengaluru,"Bengaluru, India",SQL Excel Data Analysis Google Sheets Data Management Advanced Excel Retention Strategy Execution,"data analysis, excel, firewalls, linux, network security, penetration testing, siem, soc, sql, vulnerability assessment",10,"Cybersecurity Analyst data analysis, excel, firewalls, linux, network security, penetration testing, siem, soc, sql, vulnerability assessment SQL Excel Data Analysis Google Sheets Data Management Advanced Excel Retention Strategy Execution B.Tech On-site Bengaluru",B.Tech,On-site,1,4,7,1 week ago,Not Disclosed,,,860000,Naukri,"excel, sql, data analysis, r",4
Cybersecurity Analyst,Analyst,Eversana India Pvt. Ltd,Bengaluru,"Bengaluru, India",tableau Claims Pharma business rules Life sciences MS Office Analytics CRM,"firewalls, linux, network security, penetration testing, siem, soc, tableau, vulnerability assessment",8,"Cybersecurity Analyst firewalls, linux, network security, penetration testing, siem, soc, tableau, vulnerability assessment tableau Claims Pharma business rules Life sciences MS Office Analytics CRM B.Tech On-site Bengaluru",B.Tech,On-site,1,6,7,1 week ago,Not Disclosed,,,860000,Naukri,"tableau, r",2
Cybersecurity Analyst,Analyst,Ey,Gurugram,"Gurugram, India",Assurance Backend Compliance Client servicing Risk assessment Analytical Consulting Legal,"firewalls, linux, network security, penetration testing, siem, soc, vulnerability assessment",7,"Cybersecurity Analyst firewalls, linux, network security, penetration testing, siem, soc, vulnerability assessment Assurance Backend Compliance Client servicing Risk assessment Analytical Consulting Legal B.Tech On-site Gurugram",B.Tech,On-site,3,8,7,1 week ago,Not Disclosed,,,980000,Naukri,r,1
Cybersecurity Analyst,"Analyst, Deductions - UK",Elf Beauty,Ahmedabad,"Ahmedabad, India",Order management Claims SAP Sales Analytical Artificial Intelligence Cosmetics EDI,"firewalls, linux, network security, penetration testing, siem, soc, vulnerability assessment",7,"Cybersecurity Analyst firewalls, linux, network security, penetration testing, siem, soc, vulnerability assessment Order management Claims SAP Sales Analytical Artificial Intelligence Cosmetics EDI B.Tech On-site Ahmedabad",B.Tech,On-site,1,3,7,1 week ago,Not Disclosed,,,860000,Naukri,r,1
Cybersecurity Analyst,Analyst / Associate,Singhi Advisors,Bengaluru,"Mumbai, New Delhi, Bengaluru, India",Due diligence Financial statements Networking Equity research MIS Project management Analytical Corporate finance,"firewalls, linux, network security, penetration testing, siem, soc, vulnerability assessment",7,"Cybersecurity Analyst firewalls, linux, network security, penetration testing, siem, soc, vulnerability assessment Due diligence Financial statements Networking Equity research MIS Project management Analytical Corporate finance B.Tech On-site Bengaluru",B.Tech,On-site,1,2,30,3+ weeks ago,Not Disclosed,,,860000,Naukri,r,1
Cybersecurity Analyst,IRM Developer,Gratuity Consulting,Bengaluru,"Bengaluru, India",risk management risk assessment project management iso cyber security sap security information security sod,"firewalls, linux, network security, penetration testing, siem, soc, vulnerability assessment",7,"Cybersecurity Analyst firewalls, linux, network security, penetration testing, siem, soc, vulnerability assessment risk management risk assessment project management iso cyber security sap security information security sod B.Tech On-site Bengaluru",B.Tech,On-site,4,8,30,3+ weeks ago,Not Disclosed,,,1040000,Naukri,r,1
Cybersecurity Analyst,VAPT Consultant,Cyraac Services,Bengaluru,"Bengaluru, India",burp suite software testing maltego cyber security network security owasp sqlmap information security,"firewalls, linux, network security, penetration testing, siem, soc, vulnerability assessment",7,"Cybersecurity Analyst firewalls, linux, network security, penetration testing, siem, soc, vulnerability assessment burp suite software testing maltego cyber security network security owasp sqlmap information security B.Tech On-site Bengaluru",B.Tech,On-site,1,2,30,3+ weeks ago,Not Disclosed,,,860000,Naukri,"sql, r",2
Cybersecurity Analyst,Associate,Ark Legal,Mumbai,"Mumbai, India",it risk management risk management risk assessment law iso cyber security hipaa soc,"firewalls, linux, network security, penetration testing, siem, soc, vulnerability assessment",7,"Cybersecurity Analyst firewalls, linux, network security, penetration testing, siem, soc, vulnerability assessment it risk management risk management risk assessment law iso cyber security hipaa soc B.Tech On-site Mumbai",B.Tech,On-site,2,4,30,3+ weeks ago,Not Disclosed,,,920000,Naukri,r,1
Cybersecurity Analyst,Cybersecurity FT Associate,Antwalk,Mumbai,"Mumbai, India",SAN Head Business Development ISO cyber security SOC Analytical SMS Internship,"firewalls, linux, network security, penetration testing, siem, soc, vulnerability assessment",7,"Cybersecurity Analyst firewalls, linux, network security, penetration testing, siem, soc, vulnerability assessment SAN Head Business Development ISO cyber security SOC Analytical SMS Internship B.Tech On-site Mumbai",B.Tech,On-site,3,6,30,3+ weeks ago,Not Disclosed,,,980000,Naukri,r,1
Cybersecurity Analyst,Analyst,Arp Investments,Bengaluru,"Kolkata, Mumbai, New Delhi, Hyderabad, Pune, Chennai, Bengaluru, India",Analyst Investor relations Data management Risk management Portfolio management Forecasting Analytics Python,"firewalls, linux, network security, penetration testing, python, siem, soc, vulnerability assessment",8,"Cybersecurity Analyst firewalls, linux, network security, penetration testing, python, siem, soc, vulnerability assessment Analyst Investor relations Data management Risk management Portfolio management Forecasting Analytics Python B.Tech On-site Bengaluru",B.Tech,On-site,2,4,30,3+ weeks ago,Not Disclosed,,,920000,Naukri,"python, r",2
Cybersecurity Analyst,Analyst - Partnerships,Showpad,Pune,"Pune, India",Publishing Operational excellence Planning Executive Business intelligence Stakeholder management Forecasting Analytics CRM,"firewalls, linux, network security, penetration testing, siem, soc, vulnerability assessment",7,"Cybersecurity Analyst firewalls, linux, network security, penetration testing, siem, soc, vulnerability assessment Publishing Operational excellence Planning Executive Business intelligence Stakeholder management Forecasting Analytics CRM B.Tech On-site Pune",B.Tech,On-site,2,5,21,3 weeks ago,Not Disclosed,,,920000,Naukri,"excel, r",2
Cybersecurity Analyst,Analyst - Commerce,Epsilon Data Management,Bengaluru,"Bengaluru, India",Bfsi Agile FMCG SEO Digital marketing Gaming Catering Media planning,"agile, firewalls, linux, network security, penetration testing, siem, soc, vulnerability assessment",8,"Cybersecurity Analyst agile, firewalls, linux, network security, penetration testing, siem, soc, vulnerability assessment Bfsi Agile FMCG SEO Digital marketing Gaming Catering Media planning B.Tech On-site Bengaluru",B.Tech,On-site,1,2,21,3 weeks ago,Not Disclosed,,,860000,Naukri,"git, r",2
