role,title,company,city,location,description,skills,skill_count,combined_text,education,job_mode,experience_min,experience_max,days_ago,posted_date,salary_raw,salary_min,salary_max,salary_estimate,source,extracted_skills,extracted_skill_count
Mobile App Developer,MOBILE APP DEVELOPER,Media3 International,Other,India,gsm umts css software development ux software testing hsdpa user interface designing,"android, css, flutter, ios, javascript, kotlin, react, react native, swift",9,"Mobile App Developer android, css, flutter, ios, javascript, kotlin, react, react native, swift gsm umts css software development ux software testing hsdpa user interface designing B.Tech On-site India",B.Tech,On-site,0,1,30,3+ weeks ago,Not Disclosed,,,700000,Naukri,r,1
Mobile App Developer,Mobile Application Developer,Write Academy,Chennai,"Chennai, India",development testing Application development IOS Android Python Testing Mobile applications Mobile application development,"android, flutter, ios, javascript, kotlin, python, react, react native, swift",9,"Mobile App Developer android, flutter, ios, javascript, kotlin, python, react, react native, swift development testing Application development IOS Android Python Testing Mobile applications Mobile application development B.Tech On-site Chennai",B.Tech,On-site,1,4,30,3+ weeks ago,Not Disclosed,,,760000,Naukri,"python, r",2
Mobile App Developer,Mobile Application Developer,Zamik Infotech,Mumbai,"Mumbai, India",Core Java android application development Coding Application programming Debugging android studio Swift SDK,"android, flutter, ios, java, javascript, kotlin, react, react native, swift",9,"Mobile App Developer android, flutter, ios, java, javascript, kotlin, react, react native, swift Core Java android application development Coding Application programming Debugging android studio Swift SDK B.Tech On-site Mumbai",B.Tech,On-site,2,3,30,3+ weeks ago,Not Disclosed,,,820000,Naukri,"java, r",2
Mobile App Developer,Mobile App Developer,Eleventure Systems & Services,Gurugram,"Gurugram, India",gsm umts css software development ux software testing user interface designing android,"android, css, flutter, ios, javascript, kotlin, react, react native, swift",9,"Mobile App Developer android, css, flutter, ios, javascript, kotlin, react, react native, swift gsm umts css software development ux software testing user interface designing android B.Tech On-site Gurugram",B.Tech,On-site,0,2,30,3+ weeks ago,Not Disclosed,,,700000,Naukri,r,1
Mobile App Developer,Mobile App Developer,Brainvault Technologies Llp,Chennai,"Chennai, India",java app development software development mobile applications design inte communication and interpersonal skills programming languages,"android, flutter, ios, java, javascript, kotlin, react, react native, swift",9,"Mobile App Developer android, flutter, ios, java, javascript, kotlin, react, react native, swift java app development software development mobile applications design inte communication and interpersonal skills programming languages B.Tech On-site Chennai",B.Tech,On-site,4,9,21,3 weeks ago,Not Disclosed,,,940000,Naukri,"java, r",2
Mobile App Developer,Flutter / Mobile App Developer,Sevenm Technologies,Kolkata,"Kolkata, India",gsm umts css software development ux sqlite software testing hsdpa,"android, css, flutter, ios, javascript, kotlin, react, react native, sqlite, swift",10,"Mobile App Developer android, css, flutter, ios, javascript, kotlin, react, react native, sqlite, swift gsm umts css software development ux sqlite software testing hsdpa B.Tech On-site Kolkata",B.Tech,On-site,0,3,30,3+ weeks ago,Not Disclosed,,,700000,Naukri,"sql, r",2
Mobile App Developer,Mobile App Developer,Genius Mind Systems,Noida,"Noida, India",gsm umts css software development ux software testing user interface designing android,"android, css, flutter, ios, javascript, kotlin, react, react native, swift",9,"Mobile App Developer android, css, flutter, ios, javascript, kotlin, react, react native, swift gsm umts css software development ux software testing user interface designing android B.Tech On-site Noida",B.Tech,On-site,0,4,30,3+ weeks ago,Not Disclosed,,,700000,Naukri,r,1
Mobile App Developer,Mobile Application Developer,Dainik Bhaskar Group,Ahmedabad,"Bhopal, Ahmedabad, India",Javascript React Native Android Application Development Ios Development IOS Mobile Application Development Android Io,"android, flutter, ios, javascript, kotlin, react, react native, swift",8,"Mobile App Developer android, flutter, ios, javascript, kotlin, react, react native, swift Javascript React Native Android Application Development Ios Development IOS Mobile Application Development Android Io B.Tech On-site Ahmedabad",B.Tech,On-site,3,6,21,3 weeks ago,Not Disclosed,,,880000,Naukri,"javascript, react, java, r",4
Mobile App Developer,Mobile App Developer / Associate,Nasscomm,Noida,"Noida, India",Mobile application development Backend GIT Mobile development Project management Mobile applications Stakeholder management JIRA,"android, flutter, git, ios, javascript, jira, kotlin, react, react native, swift",10,"Mobile App Developer android, flutter, git, ios, javascript, jira, kotlin, react, react native, swift Mobile application development Backend GIT Mobile development Project management Mobile applications Stakeholder management JIRA B.Tech On-site Noida",B.Tech,On-site,4,8,14,2 weeks ago,Not Disclosed,,,940000,Naukri,"git, r",2
Mobile App Developer,Mobile Application Developer,Orbis Hospitality Services,Hyderabad,"Hyderabad, India",React Native Java Android Application Development Mobile Development Mobile Application Development Android Kotlin Development,"android, flutter, ios, java, javascript, kotlin, react, react native, swift",9,"Mobile App Developer android, flutter, ios, java, javascript, kotlin, react, react native, swift React Native Java Android Application Development Mobile Development Mobile Application Development Android Kotlin Development B.Tech On-site Hyderabad",B.Tech,On-site,5,10,7,1 week ago,Not Disclosed,,,1000000,Naukri,"react, java, r",3
Mobile App Developer,Mobile App Developer,Whats In A Name Creatives,Hyderabad,"Hyderabad, India",software development version control android problem solving mobile application development ios javascript app development,"android, flutter, ios, javascript, kotlin, react, react native, swift",8,"Mobile App Developer android, flutter, ios, javascript, kotlin, react, react native, swift software development version control android problem solving mobile application development ios javascript app development B.Tech On-site Hyderabad",B.Tech,On-site,1,3,14,2 weeks ago,Not Disclosed,,,760000,Naukri,"javascript, java, r",3
Mobile App Developer,Mobile App Developer,Ocode Technologies,Other,India,Computer science Health insurance Backend Automation testing Publishing PDF Provident fund Networking,"android, flutter, ios, javascript, kotlin, react, react native, swift",8,"Mobile App Developer android, flutter, ios, javascript, kotlin, react, react native, swift Computer science Health insurance Backend Automation testing Publishing PDF Provident fund Networking B.Tech On-site India",B.Tech,On-site,1,6,30,3+ weeks ago,Not Disclosed,,,760000,Naukri,r,1
Mobile App Developer,Application Developer-Mobile-React Native+Node.JS+AWS Services,Ibm,Bengaluru,"Bengaluru, India",Application Developer Java Mobile Platforms Aws Services Architecture Apis Programming Api Integration,"android, aws, flutter, ios, java, javascript, kotlin, node.js, react, react native, swift",11,"Mobile App Developer android, aws, flutter, ios, java, javascript, kotlin, node.js, react, react native, swift Application Developer Java Mobile Platforms Aws Services Architecture Apis Programming Api Integration B.Tech On-site Bengaluru",B.Tech,On-site,6,7,4,4 days ago,Not Disclosed,,,1060000,Naukri,"aws, java, r",3
Mobile App Developer,Mobile App Developer,F.T. Solutions,Other,India,Backend GIT Mobile development Networking Coding Javascript Mobile applications Troubleshooting,"android, flutter, git, ios, javascript, kotlin, react, react native, swift",9,"Mobile App Developer android, flutter, git, ios, javascript, kotlin, react, react native, swift Backend GIT Mobile development Networking Coding Javascript Mobile applications Troubleshooting B.Tech On-site India",B.Tech,On-site,1,2,30,3+ weeks ago,Not Disclosed,,,760000,Naukri,"javascript, java, git, r",4
Mobile App Developer,Mobile App Developer,Ine Infotech,Ahmedabad,"Ahmedabad, India",rest css ux sqlite android kotlin android studio react native,"android, css, flutter, ios, javascript, kotlin, react, react native, sqlite, swift",10,"Mobile App Developer android, css, flutter, ios, javascript, kotlin, react, react native, sqlite, swift rest css ux sqlite android kotlin android studio react native B.Tech On-site Ahmedabad",B.Tech,On-site,1,4,30,3+ weeks ago,Not Disclosed,,,760000,Naukri,"react, sql, r",3
Mobile App Developer,Mobile App - Developer,Exact,Other,India,Computer science Backend Mobile development C SQLite Swift Mobile applications IOS,"android, flutter, ios, javascript, kotlin, react, react native, sqlite, swift",9,"Mobile App Developer android, flutter, ios, javascript, kotlin, react, react native, sqlite, swift Computer science Backend Mobile development C SQLite Swift Mobile applications IOS B.Tech On-site India",B.Tech,On-site,1,6,30,3+ weeks ago,Not Disclosed,,,760000,Naukri,"sql, r",2
Mobile App Developer,Mobile App Developer,Ultragits,Chennai,"Chennai, India",sqlite android android studio kotlin react native mobile application development ios iphone,"android, flutter, ios, javascript, kotlin, react, react native, sqlite, swift",9,"Mobile App Developer android, flutter, ios, javascript, kotlin, react, react native, sqlite, swift sqlite android android studio kotlin react native mobile application development ios iphone B.Tech On-site Chennai",B.Tech,On-site,1,2,30,3+ weeks ago,Not Disclosed,,,760000,Naukri,"react, sql, r",3
Mobile App Developer,Mobile App Developer,Skilviu Soft Solutions,Hyderabad,"Hyderabad, India",Backend Finance Debugging Manager Technology Mobile applications IOS Android Management,"android, flutter, ios, javascript, kotlin, react, react native, swift",8,"Mobile App Developer android, flutter, ios, javascript, kotlin, react, react native, swift Backend Finance Debugging Manager Technology Mobile applications IOS Android Management B.Tech On-site Hyderabad",B.Tech,On-site,1,3,21,3 weeks ago,Not Disclosed,,,760000,Naukri,r,1
Mobile App Developer,Mobile App Developer,Omschrift Inventions (Opc),Ahmedabad,"Ahmedabad, India",software development version control android problem solving react native ios mobile application development scalability,"android, flutter, ios, javascript, kotlin, react, react native, swift",8,"Mobile App Developer android, flutter, ios, javascript, kotlin, react, react native, swift software development version control android problem solving react native ios mobile application development scalability B.Tech On-site Ahmedabad",B.Tech,On-site,2,4,30,3+ weeks ago,Not Disclosed,,,820000,Naukri,"react, r",2
Mobile App Developer,Mobile App Developer - Flutter,Ecs Me,Hyderabad,"Hyderabad, India",Backend github Version control GIT MVVM Agile scrum Debugging Mobile applications,"agile, android, flutter, git, ios, javascript, kotlin, react, react native, scrum, swift",11,"Mobile App Developer agile, android, flutter, git, ios, javascript, kotlin, react, react native, scrum, swift Backend github Version control GIT MVVM Agile scrum Debugging Mobile applications B.Tech On-site Hyderabad",B.Tech,On-site,3,4,30,3+ weeks ago,Not Disclosed,,,880000,Naukri,"git, r",2
Mobile App Developer,Mobile App Developer,Cal4Care,Bengaluru,"Kolkata, Mumbai, New Delhi, Hyderabad, Pune, Chennai, Bengaluru, India",Computer languages Interpersonal skills telco Manager Technology Windows Mobile applications Research IOS,"android, flutter, ios, javascript, kotlin, react, react native, swift",8,"Mobile App Developer android, flutter, ios, javascript, kotlin, react, react native, swift Computer languages Interpersonal skills telco Manager Technology Windows Mobile applications Research IOS B.Tech On-site Bengaluru",B.Tech,On-site,1,4,30,3+ weeks ago,Not Disclosed,,,760000,Naukri,r,1
Mobile App Developer,Mobile App Developer,Subtle Solutions,Pune,"Pune, India",ux sqlite android kotlin android mobile application development react native mobile application development ios,"android, flutter, ios, javascript, kotlin, react, react native, sqlite, swift",9,"Mobile App Developer android, flutter, ios, javascript, kotlin, react, react native, sqlite, swift ux sqlite android kotlin android mobile application development react native mobile application development ios B.Tech On-site Pune",B.Tech,On-site,2,5,30,3+ weeks ago,Not Disclosed,,,820000,Naukri,"react, sql, r",3
Mobile App Developer,Mobile App Developer,B4B It Solutions,Hyderabad,"Hyderabad, India",Computer science Backend Version control GIT Agile scrum Coding Debugging Mobile applications,"agile, android, flutter, git, ios, javascript, kotlin, react, react native, scrum, swift",11,"Mobile App Developer agile, android, flutter, git, ios, javascript, kotlin, react, react native, scrum, swift Computer science Backend Version control GIT Agile scrum Coding Debugging Mobile applications B.Tech On-site Hyderabad",B.Tech,On-site,2,5,30,3+ weeks ago,Not Disclosed,,,820000,Naukri,"git, r",2
Mobile App Developer,Mobile APP Developer,Technor Solutions,Chennai,"Chennai, India",rest css sqlite android android studio react native mobile application development ios,"android, css, flutter, ios, javascript, kotlin, react, react native, sqlite, swift",10,"Mobile App Developer android, css, flutter, ios, javascript, kotlin, react, react native, sqlite, swift rest css sqlite android android studio react native mobile application development ios B.Tech On-site Chennai",B.Tech,On-site,2,7,30,3+ weeks ago,Not Disclosed,,,820000,Naukri,"react, sql, r",3
Mobile App Developer,Mobile App Developer,Ajax Media Tech,Chennai,"Chennai, India",rest ux version control android kotlin react native bug fixing ios,"android, flutter, ios, javascript, kotlin, react, react native, swift",8,"Mobile App Developer android, flutter, ios, javascript, kotlin, react, react native, swift rest ux version control android kotlin react native bug fixing ios B.Tech On-site Chennai",B.Tech,On-site,4,8,30,3+ weeks ago,Not Disclosed,,,940000,Naukri,"react, r",2
Mobile App Developer,Mobile App Developer,Sentient Systems,Mumbai,"Mumbai, India",rest c sqlite android android studio kotlin ios mobile application development,"android, flutter, ios, javascript, kotlin, react, react native, sqlite, swift",9,"Mobile App Developer android, flutter, ios, javascript, kotlin, react, react native, sqlite, swift rest c sqlite android android studio kotlin ios mobile application development B.Tech On-site Mumbai",B.Tech,On-site,2,7,30,3+ weeks ago,Not Disclosed,,,820000,Naukri,"sql, r",2
Mobile App Developer,Mobile App Developer,South Nests,Chennai,"Chennai, India",Web technologies html5 Application programming Analytical IT skills android studio Javascript Mobile applications,"android, flutter, ios, javascript, kotlin, react, react native, swift",8,"Mobile App Developer android, flutter, ios, javascript, kotlin, react, react native, swift Web technologies html5 Application programming Analytical IT skills android studio Javascript Mobile applications B.Tech On-site Chennai",B.Tech,On-site,3,8,30,3+ weeks ago,Not Disclosed,,,880000,Naukri,"javascript, java, r",3
Mobile App Developer,MOBILE APP DEVELOPER,Khelomore,Mumbai,"Mumbai, India",Mobile application development CSS jQuery Agile development Programming Javascript HTML JSON,"agile, android, css, flutter, html, ios, javascript, kotlin, react, react native, swift",11,"Mobile App Developer agile, android, css, flutter, html, ios, javascript, kotlin, react, react native, swift Mobile application development CSS jQuery Agile development Programming Javascript HTML JSON B.Tech On-site Mumbai",B.Tech,On-site,4,5,30,3+ weeks ago,Not Disclosed,,,940000,Naukri,"javascript, java, r",3
Mobile App Developer,Mobile App Developer,Prakrut Software,Bengaluru,"Bengaluru, India",rest css sqlite android android studio react native mobile application development ios,"android, css, flutter, ios, javascript, kotlin, react, react native, sqlite, swift",10,"Mobile App Developer android, css, flutter, ios, javascript, kotlin, react, react native, sqlite, swift rest css sqlite android android studio react native mobile application development ios B.Tech On-site Bengaluru",B.Tech,On-site,3,8,30,3+ weeks ago,Not Disclosed,,,880000,Naukri,"react, sql, r",3
Mobile App Developer,Mobile App Developer,Qorvatech,Noida,"Noida, India",Computer science Mobile technology Backend Version control Coding Debugging HTML Android SDK,"android, flutter, html, ios, javascript, kotlin, react, react native, swift",9,"Mobile App Developer android, flutter, html, ios, javascript, kotlin, react, react native, swift Computer science Mobile technology Backend Version control Coding Debugging HTML Android SDK B.Tech On-site Noida",B.Tech,On-site,8,13,30,3+ weeks ago,Not Disclosed,,,1180000,Naukri,r,1
Mobile App Developer,Mobile App Developer,Hawkscode,Jaipur,"Jaipur, India",app development trend android mobile applications mobile application development Application development Application Development,"android, flutter, ios, javascript, kotlin, react, react native, swift",8,"Mobile App Developer android, flutter, ios, javascript, kotlin, react, react native, swift app development trend android mobile applications mobile application development Application development Application Development B.Tech On-site Jaipur",B.Tech,On-site,1,5,30,3+ weeks ago,Not Disclosed,,,760000,Naukri,r,1
Mobile App Developer,Mobile App Developer,Exciteon,Other,India,rest css sqlite android kotlin mobile application development ios xcode,"android, css, flutter, ios, javascript, kotlin, react, react native, sqlite, swift",10,"Mobile App Developer android, css, flutter, ios, javascript, kotlin, react, react native, sqlite, swift rest css sqlite android kotlin mobile application development ios xcode B.Tech On-site India",B.Tech,On-site,1,3,30,3+ weeks ago,Not Disclosed,,,760000,Naukri,"sql, r",2
Mobile App Developer,Mobile App Developer,Brilino Solutions,Mumbai,"Mumbai, India",IT services XAML Usage C Mobile development MVVM Debugging Consulting,"android, flutter, ios, javascript, kotlin, react, react native, swift",8,"Mobile App Developer android, flutter, ios, javascript, kotlin, react, react native, swift IT services XAML Usage C Mobile development MVVM Debugging Consulting B.Tech On-site Mumbai",B.Tech,On-site,1,6,30,3+ weeks ago,Not Disclosed,,,760000,Naukri,r,1
Mobile App Developer,MOBILE APP DEVELOPER,Oroprise Solutions,Noida,"Noida, India",emerging technologies css software development android problem solving bootstrap ios mobile application development,"android, css, flutter, ios, javascript, kotlin, react, react native, swift",9,"Mobile App Developer android, css, flutter, ios, javascript, kotlin, react, react native, swift emerging technologies css software development android problem solving bootstrap ios mobile application development B.Tech On-site Noida",B.Tech,On-site,3,8,30,3+ weeks ago,Not Disclosed,,,880000,Naukri,r,1
Mobile App Developer,Mobile App Developer,Blitz Info System,Other,India,gsm umts css software development ux software testing user interface designing android,"android, css, flutter, ios, javascript, kotlin, react, react native, swift",9,"Mobile App Developer android, css, flutter, ios, javascript, kotlin, react, react native, swift gsm umts css software development ux software testing user interface designing android B.Tech On-site India",B.Tech,On-site,3,8,30,3+ weeks ago,Not Disclosed,,,880000,Naukri,r,1
Mobile App Developer,Mobile App Developer,Sunface Technologies,Other,India,Mobile applications angularjs Mobile App Mobile development Development Mobile application development Application,"android, flutter, ios, javascript, kotlin, react, react native, swift",8,"Mobile App Developer android, flutter, ios, javascript, kotlin, react, react native, swift Mobile applications angularjs Mobile App Mobile development Development Mobile application development Application B.Tech On-site India",B.Tech,On-site,3,8,30,3+ weeks ago,Not Disclosed,,,880000,Naukri,r,1
Mobile App Developer,Mobile App Developer,Intermind Digital Solutions,Mumbai,"Mumbai, India",android application Programming JSON Mobile applications Management Object oriented programming Mobile App OOPS,"android, flutter, ios, javascript, kotlin, react, react native, swift",8,"Mobile App Developer android, flutter, ios, javascript, kotlin, react, react native, swift android application Programming JSON Mobile applications Management Object oriented programming Mobile App OOPS B.Tech On-site Mumbai",B.Tech,On-site,1,6,30,3+ weeks ago,Not Disclosed,,,760000,Naukri,r,1
Mobile App Developer,Mobile App Developer,Pioneercodes Technologies Solutions,Kochi,"Kochi, India",gsm css hsdpa android bug fixing mobile application development requirement gathering java,"android, css, flutter, ios, java, javascript, kotlin, react, react native, swift",10,"Mobile App Developer android, css, flutter, ios, java, javascript, kotlin, react, react native, swift gsm css hsdpa android bug fixing mobile application development requirement gathering java B.Tech On-site Kochi",B.Tech,On-site,1,4,30,3+ weeks ago,Not Disclosed,,,760000,Naukri,"java, r",2
Mobile App Developer,Mobile App Developer,Baba Computers,Other,India,css sqlite android android studio kotlin react native mobile application development ios,"android, css, flutter, ios, javascript, kotlin, react, react native, sqlite, swift",10,"Mobile App Developer android, css, flutter, ios, javascript, kotlin, react, react native, sqlite, swift css sqlite android android studio kotlin react native mobile application development ios B.Tech On-site India",B.Tech,On-site,2,8,30,3+ weeks ago,Not Disclosed,,,820000,Naukri,"react, sql, r",3
Mobile App Developer,Mobile app developer,The Digital Indian,Jaipur,"Jaipur, India",sqlite android android studio mobile application development ios xcode iphone google maps,"android, flutter, ios, javascript, kotlin, react, react native, sqlite, swift",9,"Mobile App Developer android, flutter, ios, javascript, kotlin, react, react native, sqlite, swift sqlite android android studio mobile application development ios xcode iphone google maps B.Tech On-site Jaipur",B.Tech,On-site,2,4,30,3+ weeks ago,Not Disclosed,,,820000,Naukri,"sql, r",2
Mobile App Developer,MOBILE APP DEVELOPER,Picasoid,Other,India,gsm umts css software development ux software testing hsdpa user interface designing,"android, css, flutter, ios, javascript, kotlin, react, react native, swift",9,"Mobile App Developer android, css, flutter, ios, javascript, kotlin, react, react native, swift gsm umts css software development ux software testing hsdpa user interface designing B.Tech On-site India",B.Tech,On-site,1,4,30,3+ weeks ago,Not Disclosed,,,760000,Naukri,r,1
Mobile App Developer,Fultter Mobile App Developer,Object Source,Jaipur,"Jaipur, India",gsm umts css software development ux software testing user interface designing android,"android, css, flutter, ios, javascript, kotlin, react, react native, swift",9,"Mobile App Developer android, css, flutter, ios, javascript, kotlin, react, react native, swift gsm umts css software development ux software testing user interface designing android B.Tech On-site Jaipur",B.Tech,On-site,2,5,30,3+ weeks ago,Not Disclosed,,,820000,Naukri,r,1
Mobile App Developer,Mobile App Developer,Limish,Chennai,"Chennai, India",Analytical skills Software design Architectural design Design development Mobile applications Troubleshooting IOS Internship,"android, flutter, ios, javascript, kotlin, react, react native, swift",8,"Mobile App Developer android, flutter, ios, javascript, kotlin, react, react native, swift Analytical skills Software design Architectural design Design development Mobile applications Troubleshooting IOS Internship B.Tech On-site Chennai",B.Tech,On-site,1,3,30,3+ weeks ago,Not Disclosed,,,760000,Naukri,r,1
Mobile App Developer,Mobile App Developer,Maxxzoom,Pune,"Pune, India",Backend Deployment Mobile applications IOS Android Mobile application development Io Application,"android, flutter, ios, javascript, kotlin, react, react native, swift",8,"Mobile App Developer android, flutter, ios, javascript, kotlin, react, react native, swift Backend Deployment Mobile applications IOS Android Mobile application development Io Application B.Tech On-site Pune",B.Tech,On-site,2,5,30,3+ weeks ago,Not Disclosed,,,820000,Naukri,r,1
Mobile App Developer,Mobile App Developer,Requin Solutions,Jaipur,"Jaipur, India",gsm umts css software development ux software testing user interface designing android,"android, css, flutter, ios, javascript, kotlin, react, react native, swift",9,"Mobile App Developer android, css, flutter, ios, javascript, kotlin, react, react native, swift gsm umts css software development ux software testing user interface designing android B.Tech On-site Jaipur",B.Tech,On-site,3,8,30,3+ weeks ago,Not Disclosed,,,880000,Naukri,r,1
Mobile App Developer,Mobile App . Developer,Wekart Incorporation,Kolkata,"Kolkata, India",sqlite android android studio mobile application development ios xcode iphone scalability,"android, flutter, ios, javascript, kotlin, react, react native, sqlite, swift",9,"Mobile App Developer android, flutter, ios, javascript, kotlin, react, react native, sqlite, swift sqlite android android studio mobile application development ios xcode iphone scalability B.Tech On-site Kolkata",B.Tech,On-site,2,5,30,3+ weeks ago,Not Disclosed,,,820000,Naukri,"sql, r",2
